{
  "serial": "c861e640-6d28-11ea-b8ee-db02b56522a1",
  "items": ["50000336505771"],
  "condition": "action",
  "ev_type": "sorting",
  "ev_task": "fulfillment",
  "ev_stage": "fulfill",
  "coordinates": [
    "123",
    "456"
  ],
  "flow": "auto",
  "direction": "direct",
  "reason": "ABCDEFGHI",
  "version": "v2019.2",
  "origin": "aac099d5-f520-4c00-95ab-cc445bec8920",
  "owner": "46f69d00-4389-444b-9174-26b1f6f0bafa",
  "msg_for": "deeaea34-ff10-48dd-bf54-82add4b931de",
  "group": "e7f4b2dc-1648-4497-8b43-792c6d8c70c2"
}
